{
  "id": "kunninggong",
  "name": "坤宁宫",
  "description": "中轴上的后三宫行至坤宁宫。朱墙、殿门与屋檐之后，北面的御花园带来另一种游览节奏。",
  "guide": "坤宁宫在明代曾为皇后寝宫，清代改建后主要用于萨满祭祀，并保留皇帝大婚的相关空间。 中轴上的后三宫行至坤宁宫。朱墙、殿门与屋檐之后，北面的御花园带来另一种游览节奏。",
  "notice": "照片拍摄于不同年份；实际开放与展陈以故宫博物院当日公告为准。",
  "factSource": "https://www.dpm.org.cn/explore/building/236487.html",
  "x": 0.5,
  "y": 0.137,
  "heading": 0,
  "narration": {
    "text": "坤宁宫在明代曾为皇后寝宫，清代改建后主要用于萨满祭祀，并保留皇帝大婚的相关空间。 中轴上的后三宫行至坤宁宫。朱墙、殿门与屋檐之后，北面的御花园带来另一种游览节奏。"
  },
  "scene": "中轴漫游 · 坤宁宫",
  "photos": {
    "front": "front"
  }
}
