{
  "id": "taihemen",
  "name": "太和门",
  "description": "内金水河之后，太和门把视线引向外朝。先在门前看看桥与广场，再沿侧边通道继续探索。",
  "guide": "太和门是紫禁城外朝的正门，门前内金水河上的五座石桥与两侧廊庑共同组织入口广场。 内金水河之后，太和门把视线引向外朝。先在门前看看桥与广场，再沿侧边通道继续探索。",
  "notice": "太和门主通道按施工公告关闭；本地图侧向绕行为游览示意，现场通行以故宫公告为准。",
  "factSource": "https://www.dpm.org.cn/explore/building/236439.html",
  "x": 0.5,
  "y": 0.66,
  "heading": 0,
  "narration": {
    "text": "太和门是紫禁城外朝的正门，门前内金水河上的五座石桥与两侧廊庑共同组织入口广场。 内金水河之后，太和门把视线引向外朝。先在门前看看桥与广场，再沿侧边通道继续探索。"
  },
  "scene": "中轴漫游 · 太和门",
  "photos": {
    "front": "front"
  }
}
