{
  "id": "santan",
  "name": "三潭印月",
  "description": "湖面上的石塔、远处的山和来往的小船，共同组成三潭印月的经典风景。先从湖上的视角，与这处风景相遇。",
  "guide": "三潭印月位于西湖中的小瀛洲岛，是西湖十景之一。岛南湖面上立有三座石塔，月夜在塔中点灯时，灯光与月影倒映湖中，形成“三潭印月”的景致。这一景常被用作西湖的标志性画面。",
  "notice": "",
  "x": 0.472,
  "y": 0.712,
  "photoName": "三潭印月石塔与湖面 · 实拍",
  "photos": {
    "front": "front"
  }
}
