{
  "id": "cining",
  "name": "慈宁宫区",
  "description": "向西走进慈宁宫区，在另一片朱墙金瓦之间，了解与中轴大殿不同的宫廷空间。照片为慈宁宫正殿局部。",
  "guide": "慈宁宫位于内廷外西路，清代曾为太皇太后和皇太后的正宫，也承担祝寿等重大庆贺典礼。 向西走进慈宁宫区，在另一片朱墙金瓦之间，了解与中轴大殿不同的宫廷空间。照片为慈宁宫正殿局部。",
  "notice": "照片拍摄于不同年份；实际开放与展陈以故宫博物院当日公告为准。",
  "factSource": "https://www.dpm.org.cn/explore/building/236504.html",
  "x": 0.21,
  "y": 0.41,
  "heading": 0,
  "narration": {
    "text": "慈宁宫位于内廷外西路，清代曾为太皇太后和皇太后的正宫，也承担祝寿等重大庆贺典礼。 向西走进慈宁宫区，在另一片朱墙金瓦之间，了解与中轴大殿不同的宫廷空间。照片为慈宁宫正殿局部。"
  },
  "scene": "宫城探访 · 慈宁宫区",
  "photos": {
    "front": "front"
  }
}
