{
  "id": "taihedian",
  "name": "太和殿",
  "description": "金色屋顶之下，层层白石台基托起太和殿。站在广场回望中轴，感受建筑与空旷院落共同形成的秩序。",
  "guide": "太和殿是外朝三大殿之首，明清皇帝在这里举行登极、大婚等重要典礼。 金色屋顶之下，层层白石台基托起太和殿。站在广场回望中轴，感受建筑与空旷院落共同形成的秩序。",
  "notice": "照片拍摄于不同年份；实际开放与展陈以故宫博物院当日公告为准。",
  "factSource": "https://www.dpm.org.cn/explore/building/236465.html",
  "x": 0.5,
  "y": 0.49,
  "heading": 0,
  "narration": {
    "text": "太和殿是外朝三大殿之首，明清皇帝在这里举行登极、大婚等重要典礼。 金色屋顶之下，层层白石台基托起太和殿。站在广场回望中轴，感受建筑与空旷院落共同形成的秩序。"
  },
  "scene": "中轴漫游 · 太和殿",
  "photos": {
    "front": "front"
  }
}
