{
  "id": "ningshou",
  "name": "宁寿宫区",
  "description": "离开中轴向东探访宁寿宫区。这里以另一组完整的宫殿院落展开，照片展示其中的皇极殿。",
  "guide": "宁寿宫区位于内廷外东路，其中皇极殿是乾隆为归政后临朝受贺而改建的主体建筑。 离开中轴向东探访宁寿宫区。这里以另一组完整的宫殿院落展开，照片展示其中的皇极殿。",
  "notice": "照片拍摄于不同年份；实际开放与展陈以故宫博物院当日公告为准。",
  "factSource": "https://www.dpm.org.cn/show/225714.html",
  "x": 0.73,
  "y": 0.2,
  "heading": 0,
  "narration": {
    "text": "宁寿宫区位于内廷外东路，其中皇极殿是乾隆为归政后临朝受贺而改建的主体建筑。 离开中轴向东探访宁寿宫区。这里以另一组完整的宫殿院落展开，照片展示其中的皇极殿。"
  },
  "scene": "宫城探访 · 宁寿宫区",
  "photos": {
    "front": "front"
  }
}
