{
  "id": "garden",
  "name": "御花园",
  "description": "走进御花园，规整的宫殿院落转为古树、亭阁与叠石的层次。放慢脚步，看看树影与屋顶相遇的地方。",
  "guide": "御花园位于坤宁宫北侧，以钦安殿为中心，亭阁、古树、山石与彩石甬路构成宫城中的园林空间。 走进御花园，规整的宫殿院落转为古树、亭阁与叠石的层次。放慢脚步，看看树影与屋顶相遇的地方。",
  "notice": "照片拍摄于不同年份；实际开放与展陈以故宫博物院当日公告为准。",
  "factSource": "https://www.dpm.org.cn/explore/building/236519.html",
  "x": 0.46,
  "y": 0.1,
  "heading": 0,
  "narration": {
    "text": "御花园位于坤宁宫北侧，以钦安殿为中心，亭阁、古树、山石与彩石甬路构成宫城中的园林空间。 走进御花园，规整的宫殿院落转为古树、亭阁与叠石的层次。放慢脚步，看看树影与屋顶相遇的地方。"
  },
  "scene": "中轴漫游 · 御花园",
  "photos": {
    "front": "front"
  }
}
