{
  "id": "jiaotaidian",
  "name": "交泰殿",
  "description": "交泰殿位于乾清宫与坤宁宫之间。小巧方正的殿堂，让中轴上的建筑再次呈现大小相间的韵律。",
  "guide": "交泰殿位于乾清宫与坤宁宫之间，清代曾存放二十五方宝玺，也是皇后生日接受庆贺的地方。 交泰殿位于乾清宫与坤宁宫之间。小巧方正的殿堂，让中轴上的建筑再次呈现大小相间的韵律。",
  "notice": "照片拍摄于不同年份；实际开放与展陈以故宫博物院当日公告为准。",
  "factSource": "https://www.dpm.org.cn/explore/building/236467.html",
  "x": 0.5,
  "y": 0.17,
  "heading": 0,
  "narration": {
    "text": "交泰殿位于乾清宫与坤宁宫之间，清代曾存放二十五方宝玺，也是皇后生日接受庆贺的地方。 交泰殿位于乾清宫与坤宁宫之间。小巧方正的殿堂，让中轴上的建筑再次呈现大小相间的韵律。"
  },
  "scene": "中轴漫游 · 交泰殿",
  "photos": {
    "front": "front"
  }
}
