{
  "id": "leifeng",
  "name": "雷峰塔",
  "description": "隔着湖面望向雷峰塔，塔影从树梢上显露出来。把视线从近处的水面慢慢移向山丘，感受西湖风景的层次。",
  "guide": "雷峰塔位于西湖南岸的夕照山上，“雷峰夕照”是西湖十景之一。原塔始建于五代吴越国时期，1924 年倒塌；现在的塔是 2002 年在原址上重建的。民间传说《白蛇传》中，白娘子被镇于雷峰塔下。",
  "notice": "",
  "x": 0.613,
  "y": 0.738,
  "photoName": "湖对岸的雷峰塔 · 2025 年实拍",
  "photos": {
    "front": "front"
  }
}
