{
  "id": "duanqiao",
  "name": "断桥",
  "description": "桥上是行人的脚步，桥下是铺开的湖光。先看看雨中的断桥，再把这处熟悉的西湖风景放进你的游览清单。",
  "guide": "断桥位于白堤东端，是西湖十景“断桥残雪”所在地。冬日雪后，桥面向阳一侧积雪先化，远看像桥身断开，“断桥残雪”由此得名。民间传说《白蛇传》中，白娘子与许仙在断桥相遇。",
  "notice": "",
  "x": 0.652,
  "y": 0.092,
  "photoName": "雨中的断桥 · 2025 年实拍",
  "photos": {
    "front": "front"
  }
}
