{
  "id": "shenwumen",
  "name": "神武门",
  "description": "沿着中轴走到神武门，回望这一路经过的院落与宫殿。它也是今天故宫参观的出口之一。",
  "guide": "神武门是紫禁城的北门，明代称玄武门，清代因避康熙帝名讳改为现名。 沿着中轴走到神武门，回望这一路经过的院落与宫殿。它也是今天故宫参观的出口之一。",
  "notice": "照片拍摄于不同年份；实际开放与展陈以故宫博物院当日公告为准。",
  "factSource": "https://www.dpm.org.cn/explore/building/236456.html",
  "x": 0.5,
  "y": 0.047,
  "heading": 0,
  "narration": {
    "text": "神武门是紫禁城的北门，明代称玄武门，清代因避康熙帝名讳改为现名。 沿着中轴走到神武门，回望这一路经过的院落与宫殿。它也是今天故宫参观的出口之一。"
  },
  "scene": "中轴漫游 · 神武门",
  "photos": {
    "front": "front"
  }
}
