{
  "id": "baohedian",
  "name": "保和殿",
  "description": "走过中和殿，来到外朝三大殿的北端。回望重叠的屋脊，再循着院落走向内廷。",
  "guide": "保和殿位于外朝三大殿的北端，清代既用于宫廷宴会，也曾用作殿试场所。 走过中和殿，来到外朝三大殿的北端。回望重叠的屋脊，再循着院落走向内廷。",
  "notice": "照片拍摄于不同年份；实际开放与展陈以故宫博物院当日公告为准。",
  "factSource": "https://www.dpm.org.cn/explore/building/236434.html",
  "x": 0.5,
  "y": 0.29,
  "heading": 0,
  "narration": {
    "text": "保和殿位于外朝三大殿的北端，清代既用于宫廷宴会，也曾用作殿试场所。 走过中和殿，来到外朝三大殿的北端。回望重叠的屋脊，再循着院落走向内廷。"
  },
  "scene": "中轴漫游 · 保和殿",
  "photos": {
    "front": "front"
  }
}
