{
  "id": "pinghu",
  "name": "平湖秋月",
  "description": "借一张园林实拍，看看平湖秋月一带的水岸、石桥与树影。不同季节，自有不同的停留理由。",
  "guide": "平湖秋月位于白堤西端、孤山南麓，是西湖十景之一。这里临水而建，视野开阔，是传统的秋夜赏月之处。景点内有临水平台与亭阁，可以眺望外西湖湖面。",
  "notice": "",
  "x": 0.505,
  "y": 0.285,
  "photoName": "平湖秋月园景 · 2010 年实拍",
  "photos": {
    "front": "front"
  }
}
