{
  "id": "zhonghedian",
  "name": "中和殿",
  "description": "三大殿之间，中和殿以较小的方形体量和四角攒尖顶形成节奏变化。看看它与前后两座大殿有什么不同。",
  "guide": "中和殿位于太和殿与保和殿之间，采用单檐四角攒尖顶，皇帝参加大典前曾在此休息和接受执事官员朝拜。 三大殿之间，中和殿以较小的方形体量和四角攒尖顶形成节奏变化。看看它与前后两座大殿有什么不同。",
  "notice": "照片拍摄于不同年份；实际开放与展陈以故宫博物院当日公告为准。",
  "factSource": "https://www.dpm.org.cn/explore/building/236464.html",
  "x": 0.5,
  "y": 0.37,
  "heading": 0,
  "narration": {
    "text": "中和殿位于太和殿与保和殿之间，采用单檐四角攒尖顶，皇帝参加大典前曾在此休息和接受执事官员朝拜。 三大殿之间，中和殿以较小的方形体量和四角攒尖顶形成节奏变化。看看它与前后两座大殿有什么不同。"
  },
  "scene": "中轴漫游 · 中和殿",
  "photos": {
    "front": "front"
  }
}
