{
  "id": "quyuan",
  "name": "曲院风荷",
  "description": "从水面延伸到岸边的绿意，是曲院风荷的另一种看法。照片从高处望向园区与玉带桥，夏日荷景则留待下次亲自相遇。",
  "guide": "曲院风荷是西湖十景之一，位于西湖西北岸、苏堤北端附近。南宋时这里有酿酒的作坊，湖面种植荷花，夏日荷风送香，因而得名。今天的园区以夏季赏荷闻名，园中可见玉带桥。",
  "notice": "",
  "x": 0.172,
  "y": 0.375,
  "photoName": "曲院风荷一带与玉带桥 · 实拍",
  "photos": {
    "front": "front"
  }
}
