{
  "id": "qianqinggong",
  "name": "乾清宫",
  "description": "穿过乾清门，院落的尺度逐渐收拢。乾清宫位于内廷中轴线上，是了解宫廷生活与政务的重要一站。",
  "guide": "乾清宫是内廷后三宫的首座正宫，明代与清初曾为皇帝寝宫，清雍正以后仍承担理政和典礼等功能。 穿过乾清门，院落的尺度逐渐收拢。乾清宫位于内廷中轴线上，是了解宫廷生活与政务的重要一站。",
  "notice": "照片拍摄于不同年份；实际开放与展陈以故宫博物院当日公告为准。",
  "factSource": "https://www.dpm.org.cn/explore/building/236472.html",
  "x": 0.5,
  "y": 0.215,
  "heading": 0,
  "narration": {
    "text": "乾清宫是内廷后三宫的首座正宫，明代与清初曾为皇帝寝宫，清雍正以后仍承担理政和典礼等功能。 穿过乾清门，院落的尺度逐渐收拢。乾清宫位于内廷中轴线上，是了解宫廷生活与政务的重要一站。"
  },
  "scene": "中轴漫游 · 乾清宫",
  "photos": {
    "front": "front"
  }
}
