{
  "id": "wumen",
  "name": "午门",
  "description": "从午门开始，看看两翼展开的城楼，再沿着院落向宫城深处走去。抬头辨认建筑的层次，是读懂故宫的第一步。",
  "guide": "午门是紫禁城南端的正门，凹字形城台与五座门楼构成了层次分明的宫城入口。 从午门开始，看看两翼展开的城楼，再沿着院落向宫城深处走去。抬头辨认建筑的层次，是读懂故宫的第一步。",
  "notice": "照片拍摄于不同年份；实际开放与展陈以故宫博物院当日公告为准。",
  "factSource": "https://www.dpm.org.cn/explore/building/236454.html",
  "x": 0.5,
  "y": 0.84,
  "heading": 0,
  "narration": {
    "text": "午门是紫禁城南端的正门，凹字形城台与五座门楼构成了层次分明的宫城入口。 从午门开始，看看两翼展开的城楼，再沿着院落向宫城深处走去。抬头辨认建筑的层次，是读懂故宫的第一步。"
  },
  "scene": "中轴漫游 · 午门",
  "photos": {
    "front": "front"
  }
}
